{
  "executionContextID": "example",
  "recoveryPlanID": "example",
  "policyDecision": {
    "policyDecisionID": "example",
    "decision": "ALLOW",
    "policyBundleID": "example",
    "reasons": [
      "example"
    ],
    "diagnosticReference": {
      "diagnosticID": "example",
      "chainRootReference": "example",
      "diagnosticKind": "STATE_VALIDITY",
      "ruleReferences": [
        {
          "ruleID": "ASH-STATE-VALIDITY-001",
          "sourceReference": "example",
          "ruleFamily": "example"
        }
      ]
    }
  },
  "backupResult": {
    "backupResultID": "example",
    "status": "SUCCEEDED",
    "backupRecord": {
      "backupRecordID": "example",
      "sourceDocument": {
        "documentID": "example",
        "role": "OBSERVED",
        "canonicalHash": "example",
        "sourceReference": "example"
      },
      "sourceHash": "example",
      "storageReference": "example",
      "diagnosticReference": {
        "diagnosticID": "example",
        "chainRootReference": "example",
        "diagnosticKind": "STATE_VALIDITY",
        "ruleReferences": [
          {
            "ruleID": "ASH-STATE-VALIDITY-001",
            "sourceReference": "example",
            "ruleFamily": "example"
          }
        ]
      }
    },
    "diagnosticReference": {
      "diagnosticID": "example",
      "chainRootReference": "example",
      "diagnosticKind": "STATE_VALIDITY",
      "ruleReferences": [
        {
          "ruleID": "ASH-STATE-VALIDITY-001",
          "sourceReference": "example",
          "ruleFamily": "example"
        }
      ]
    }
  },
  "verificationPlan": {
    "verificationPlanID": "example",
    "checks": [
      {}
    ],
    "expectedSemanticState": {
      "stateID": "example",
      "coordinates": [
        0,
        0,
        0,
        0,
        0,
        0,
        0,
        0,
        0
      ],
      "sourceReference": "example",
      "canonicalHash": "example"
    },
    "generatedBeforeMutation": true,
    "diagnosticReference": {
      "diagnosticID": "example",
      "chainRootReference": "example",
      "diagnosticKind": "STATE_VALIDITY",
      "ruleReferences": [
        {
          "ruleID": "ASH-STATE-VALIDITY-001",
          "sourceReference": "example",
          "ruleFamily": "example"
        }
      ]
    }
  },
  "diagnosticReference": {
    "diagnosticID": "example",
    "chainRootReference": "example",
    "diagnosticKind": "STATE_VALIDITY",
    "ruleReferences": [
      {
        "ruleID": "ASH-STATE-VALIDITY-001",
        "sourceReference": "example",
        "ruleFamily": "example"
      }
    ]
  }
}
